Question ID,Category,Sub-Category,Question,Guidance,Customer Response,Notes
BUS-001,Business Requirements,Project Information,What is the name of your wireless network modernization project?,"Provide internal project reference name","",Internal project reference for tracking
BUS-002,Business Requirements,Project Information,Who is the primary stakeholder for this Wi-Fi infrastructure project?,"Name, role, and decision-making authority","",Main point of contact and decision authority
BUS-003,Business Requirements,Business Drivers,What wireless connectivity challenges are driving this network upgrade?,"Common challenges: Poor WiFi coverage, Slow performance, No visibility, Manual troubleshooting, Capacity constraints, Guest access complexity","",Primary business driver for wireless modernization
BUS-004,Business Requirements,Current State,What is your current wireless infrastructure?,"Describe current vendor/model, controller type, AP count, and limitations","",Current state baseline assessment
BUS-005,Business Requirements,Current State,What are the most common Wi-Fi issues your users experience?,"Common issues: Slow speeds, Dropped connections, Dead zones, Roaming problems, Guest access difficulties","",User experience pain points
BUS-006,Business Requirements,Objectives,What are your primary goals for wireless network modernization?,"Common goals: Improve coverage, Increase speed, Simplify management, Enable location services, Reduce troubleshooting time, Support growth","",Business objectives and expected outcomes
BUS-007,Business Requirements,Success Criteria,How will you measure wireless network success?,"Define KPIs: uptime %, user satisfaction, helpdesk ticket reduction, troubleshooting time, coverage improvements","",Success metrics for project evaluation
BUS-008,Business Requirements,Timeline,What is your expected timeline for Wi-Fi deployment?,"Typical ranges: 0-3 months, 3-6 months, 6-12 months, 12+ months","",Project timeline expectations and constraints
BUS-009,Business Requirements,Budget,What is your approved budget range for wireless infrastructure?,"Common ranges: $50K-100K, $100K-300K, $300K-1M, $1M+. Include hardware software and services","",Budget constraints for solution sizing
BUS-010,Business Requirements,Future Vision,What is your long-term vision for network infrastructure?,"Consider AI-driven operations, location analytics, IoT integration, automation","",Future roadmap and scalability planning
BUS-011,Business Requirements,Growth Projections,How do you expect wireless device counts to change over 3 years?,"Provide current device count and projected annual growth rate","",Scalability requirements and capacity planning
TECH-001,Technical Requirements,Facility Information,What is the size and type of your facility?,"Describe square footage, building materials, floor count, facility type (office, campus, warehouse)","",RF coverage planning and AP density
TECH-002,Technical Requirements,Facility Information,How many buildings or locations need wireless coverage?,"Count separate buildings, floors, and remote locations","",Deployment scope and complexity
TECH-003,Technical Requirements,Coverage Requirements,What areas require wireless coverage?,"Specify: Office spaces, Conference rooms, Common areas, Outdoor areas, Warehouses, Parking lots","",Coverage area mapping and AP placement
TECH-004,Technical Requirements,User Capacity,How many concurrent wireless users do you need to support?,"Typical ranges: 50-100, 100-500, 500-1000, 1000+","",AP density and capacity planning
TECH-005,Technical Requirements,Device Types,What types of devices connect to your wireless network?,"Devices: Laptops, Smartphones, Tablets, IoT sensors, Printers, VoIP phones, Medical devices","",Client compatibility and feature requirements
TECH-006,Technical Requirements,Performance Requirements,What throughput and bandwidth do you require?,"Specify: Per-user bandwidth, Application requirements, Download/upload speeds","",Performance targets for solution sizing
TECH-007,Technical Requirements,Wi-Fi Standards,What Wi-Fi standards do you need to support?,"Standards: Wi-Fi 6 (802.11ax), Wi-Fi 6E (6 GHz), Wi-Fi 7 future-proofing","",Technology selection and future-proofing
TECH-008,Technical Requirements,Frequency Bands,Do you need 6 GHz support (Wi-Fi 6E)?,"Benefits: More spectrum, Less interference, Higher throughput, Future-proofing","",Frequency planning and client support
TECH-009,Technical Requirements,Network Architecture,What is your preferred wireless architecture?,"Options: Cloud-managed (Mist), On-premises controller, Hybrid approach","",Management platform selection
TECH-010,Technical Requirements,Wired Network,Do you need wired network infrastructure upgrades?,"Consider: PoE switches, Switch port capacity, Uplink bandwidth, Network segmentation","",Wired assurance and switch management
TECH-011,Technical Requirements,Network Integration,What routing and switching infrastructure exists?,"Describe: Core switches, Distribution switches, VLANs, Routing protocols","",Network architecture integration
TECH-012,Technical Requirements,VLAN Requirements,How many SSIDs and VLANs do you need?,"Common VLANs: Corporate, Guest, IoT, Voice, Management","",Network segmentation requirements
TECH-013,Technical Requirements,Roaming Requirements,Do you need seamless roaming across APs?,"Use cases: VoIP calls, Video streaming, Real-time applications, Large facilities","",Roaming performance and client experience
TECH-014,Technical Requirements,Guest Access,What guest Wi-Fi capabilities do you need?,"Features: Captive portal, Social login, Vouchers, Sponsored access, Self-registration","",Guest access requirements and workflows
TECH-015,Technical Requirements,Authentication,What authentication methods are required?,"Methods: 802.1X (RADIUS), WPA2/WPA3 Enterprise, Certificate-based, PSK, Open with portal","",Security and authentication architecture
TECH-016,Technical Requirements,IoT Devices,Do you have IoT devices requiring wireless connectivity?,"Common IoT: Sensors, Cameras, Building automation, Medical devices, Asset tracking","",IoT segmentation and management
TECH-017,Technical Requirements,Location Services,Do you need indoor location tracking?,"Use cases: Wayfinding, Asset tracking, People counting, Occupancy analytics, Contact tracing","",Virtual Bluetooth LE (vBLE) requirements
TECH-018,Technical Requirements,Analytics,What wireless analytics capabilities do you need?,"Analytics: User engagement, Application usage, Presence analytics, Heatmaps, Dwell time","",Mist Premium Analytics requirements
SEC-001,Security & Compliance,Wireless Security,What wireless security standards must you meet?,"Standards: WPA2, WPA3, 802.1X, MAC filtering, Rogue AP detection","",Security policy and requirements
SEC-002,Security & Compliance,Network Segmentation,Do you need wireless network segmentation?,"Segmentation: Guest isolation, IoT isolation, Corporate separation, Role-based access","",VLAN and security zone architecture
SEC-003,Security & Compliance,Compliance Standards,What compliance frameworks must the wireless network support?,"Common standards: PCI DSS, HIPAA, SOC 2, ISO 27001, NIST, FedRAMP","",Compliance controls and audit requirements
SEC-004,Security & Compliance,Rogue Detection,Do you need rogue AP and client detection?,"Capabilities: Wireless intrusion detection, Rogue AP containment, Client isolation","",Wireless security monitoring requirements
SEC-005,Security & Compliance,Encryption,What encryption requirements apply?,"Requirements: WPA3 (AES-256), 802.1X with EAP-TLS, Certificate management","",Wireless encryption standards
SEC-006,Security & Compliance,Access Control,What access control policies are required?,"Policies: Role-based access, Time-based access, Location-based access, Device posture","",Dynamic policy enforcement requirements
SEC-007,Security & Compliance,Data Privacy,What data privacy requirements do you have?,"Privacy: User tracking consent, Data retention policies, GDPR compliance, Anonymization","",Privacy and regulatory compliance
OPS-001,Operations & Support,Uptime Requirements,What uptime requirements do you have for wireless services?,"Common targets: 99%, 99.5%, 99.9%, 99.95%, 99.99%","",SLA requirements and redundancy design
OPS-002,Operations & Support,Support Coverage,What support coverage do you require?,"Options: Business hours (8x5), Extended (24x5), Full (24x7)","",Support staffing and escalation
OPS-003,Operations & Support,Troubleshooting,How do you currently troubleshoot wireless issues?,"Current process: Packet captures, AP logs, Controller diagnostics, User reports, Site visits","",AI-driven troubleshooting value proposition
OPS-004,Operations & Support,Monitoring,What monitoring and alerting is required?,"Requirements: Uptime metrics, Performance dashboards, Anomaly alerts, Client experience scores","",Operational visibility and proactive monitoring
OPS-005,Operations & Support,Change Management,What is your process for wireless configuration changes?,"Describe: Change windows, Approval process, Testing requirements, Rollback procedures","",Configuration management and automation
OPS-006,Operations & Support,Helpdesk Integration,Do you need integration with helpdesk/ITSM systems?,"Systems: ServiceNow, Jira Service Desk, Zendesk, Email ticketing","",Incident management integration
OPS-007,Operations & Support,Network Documentation,What documentation do you require?,"Types: As-built RF maps, AP placement diagrams, Configuration guides, Troubleshooting runbooks","",Documentation deliverables
OPS-008,Operations & Support,Marvis AI,Are you interested in AI-driven network troubleshooting?,"Marvis capabilities: Conversational AI, Proactive anomaly detection, Root cause analysis, Self-healing","",Virtual network assistant adoption
AI-001,AI & Automation,AI Operations,What network operations tasks consume the most time?,"Common tasks: Troubleshooting, RF optimization, Configuration changes, Client diagnostics, Capacity planning","",AIOps value proposition and use cases
AI-002,AI & Automation,Predictive Analytics,Do you want predictive network insights?,"Insights: Anomaly detection before user impact, Capacity forecasting, Performance trends, Client experience prediction","",Mist AI capabilities requirements
AI-003,AI & Automation,Automation,What network tasks would you like to automate?,"Tasks: RF optimization, Channel selection, Power adjustment, Client steering, Configuration deployment","",AI-driven automation requirements
AI-004,AI & Automation,User Experience,How do you measure wireless user experience today?,"Current metrics: Speed tests, Helpdesk tickets, User surveys, AP uptime, Coverage maps","",Client experience SLE tracking
AI-005,AI & Automation,SLE Tracking,What Service Level Expectations (SLEs) matter most?,"SLEs: Successful connects, Time to connect, Throughput, Roaming, Capacity","",SLE definition and monitoring requirements
IMPL-001,Implementation Planning,Resources,Who will be the technical lead for this wireless project?,"Name, role, contact information","",Technical ownership and project management
IMPL-002,Implementation Planning,Team Availability,What internal resources are available for wireless deployment?,"List team members, roles, and time commitment (hours per week)","",Resource planning and project timeline feasibility
IMPL-003,Implementation Planning,Juniper Experience,What is your team's experience with Mist/Juniper wireless?,"Experience levels: No experience, Basic knowledge, Intermediate, Advanced, Expert","",Training needs assessment and knowledge transfer
IMPL-004,Implementation Planning,Deployment Approach,What is your preferred deployment approach?,"Options: Phased by building/floor, Pilot then rollout, Big bang replacement, Parallel run with cutover","",Implementation strategy and risk mitigation
IMPL-005,Implementation Planning,Site Survey,Do you need a professional RF site survey?,"Survey types: Predictive (design), Pre-deployment (validation), Post-deployment (verification)","",Site survey requirements and AP placement
IMPL-006,Implementation Planning,Cabling,What cabling infrastructure exists for APs?,"Describe: Cat6/Cat6a, PoE capacity, Drop ceiling access, Plenum requirements","",Physical installation requirements
IMPL-007,Implementation Planning,PoE Capacity,What PoE switch infrastructure do you have?,"PoE standards: 802.3af (15.4W), 802.3at (25.5W), 802.3bt (60-90W for Wi-Fi 6E)","",Power infrastructure and switch upgrades
IMPL-008,Implementation Planning,Cutover Strategy,What is your preferred AP cutover strategy?,"Options: Off-hours replacement, Weekend deployment, Staged building-by-building, Zero-downtime overlap","",Migration planning and business continuity
IMPL-009,Implementation Planning,Testing Requirements,What testing approach do you require?,"Types: RF validation, Client connectivity, Roaming, Application performance, Throughput validation","",Testing and validation requirements
IMPL-010,Implementation Planning,Training Needs,What training will be needed for IT staff?,"Types: Mist dashboard training, Marvis AI usage, Troubleshooting, RF fundamentals, Best practices","",Knowledge transfer scope and timeline
RISK-001,Risk & Constraints,Implementation Risks,What are your main concerns about wireless infrastructure migration?,"Consider: Downtime risk, Coverage gaps, Performance issues, Budget overruns, Timeline delays","",Primary implementation concerns and risk factors
RISK-002,Risk & Constraints,Failure Factors,What could cause this wireless project to fail?,"Consider: Poor RF planning, Inadequate testing, Resource constraints, User resistance, Integration issues","",Failure mode analysis and mitigation planning
RISK-003,Risk & Constraints,Coverage Risks,What are your concerns about achieving complete coverage?,"Consider: Building materials, Outdoor areas, Interference sources, Legacy client support","",RF design and coverage validation
RISK-004,Risk & Constraints,Performance Risks,What performance risks worry you most?,"Consider: User density, High-bandwidth applications, IoT device volume, Interference, Capacity limits","",Capacity planning and performance validation
RISK-005,Risk & Constraints,Dependencies,What external dependencies exist for this project?,"Examples: Cabling contractors, Electricians, PoE switch procurement, Building access approvals","",Project dependencies and critical path items
RISK-006,Risk & Constraints,Constraints,What constraints must the solution work within?,"Consider: Budget limits, Timeline, Building restrictions, Aesthetic requirements, IT policies","",Solution design boundaries and constraints
