Phase,Work Package,Task Description,Resource Type,Estimated Hours,Rate,Cost Estimate,Dependencies,Risk Level,Notes
Discovery,Business Continuity Assessment,Conduct RTO/RPO requirements analysis and business impact assessment,EO Engineer,40,$160,"=TEXT(E2*F2,""$#,##0"")",,Medium,Critical for defining DR objectives
Discovery,Current State Analysis,Evaluate existing infrastructure and identify critical applications,EO Engineer,48,$200,"=TEXT(E3*F3,""$#,##0"")",,Medium,Complete inventory of systems and dependencies
Discovery,Risk Assessment,Assess disaster scenarios and vulnerability analysis,EO Engineer,32,$175,"=TEXT(E4*F4,""$#,##0"")",,High,Include natural disasters and cyber threats
Discovery,Compliance Review,Review regulatory requirements (SOX HIPAA PCI etc.),EO Engineer,24,$180,"=TEXT(E5*F5,""$#,##0"")",,Medium,Industry-specific compliance validation
Planning,DR Architecture Design,Design disaster recovery architecture and failover mechanisms,EO Quarterback,64,$220,"=TEXT(E6*F6,""$#,##0"")",Current State Analysis,High,Multi-region architecture complexity
Planning,Recovery Strategy Planning,Define recovery procedures and failback processes,EO Engineer,40,$190,"=TEXT(E7*F7,""$#,##0"")",DR Architecture Design,Medium,Include automated and manual procedures
Planning,Implementation Roadmap,Develop phased implementation plan with milestones,EO Engineer,32,$140,"=TEXT(E8*F8,""$#,##0"")",Recovery Strategy Planning,Low,Coordinate with business continuity requirements
Planning,Vendor Selection,Evaluate and select DR tools and third-party services,EO Engineer,24,$155,"=TEXT(E9*F9,""$#,##0"")",DR Architecture Design,Medium,Include cost-benefit analysis
Implementation,Primary Site Setup,Configure primary AWS region infrastructure and monitoring,EO Engineer,80,$170,"=TEXT(E10*F10,""$#,##0"")",DR Architecture Design,Medium,Multi-AZ deployment required
Implementation,DR Site Setup,Configure secondary AWS region for disaster recovery,EO Engineer,96,$170,"=TEXT(E11*F11,""$#,##0"")",Primary Site Setup,High,Cross-region networking complexity
Implementation,Data Replication Setup,Implement database replication and backup strategies,EO Engineer,72,$160,"=TEXT(E12*F12,""$#,##0"")",DR Site Setup,High,Real-time and scheduled replication
Implementation,Application Deployment,Deploy web application across primary and DR environments,EO Engineer,88,$150,"=TEXT(E13*F13,""$#,##0"")",Data Replication Setup,Medium,Load balancer and auto-scaling configuration
Implementation,Monitoring Integration,Implement DR monitoring and alerting systems,EO Engineer,48,$145,"=TEXT(E14*F14,""$#,##0"")",Application Deployment,Medium,Health checks and failover triggers
Implementation,Network Configuration,Configure VPN DNS and routing for DR scenarios,EO Engineer,56,$165,"=TEXT(E15*F15,""$#,##0"")",DR Site Setup,High,Ensure seamless failover connectivity
Testing,DR Testing Framework,Develop automated DR testing procedures and scripts,EO Engineer,64,$140,"=TEXT(E16*F16,""$#,##0"")",Monitoring Integration,Medium,Include various disaster scenarios
Testing,Failover Testing,Execute planned failover tests and document results,EO Engineer,72,$155,"=TEXT(E17*F17,""$#,##0"")",DR Testing Framework,High,Business downtime coordination required
Testing,Performance Validation,Validate DR environment performance meets RTO/RPO requirements,EO Engineer,40,$150,"=TEXT(E18*F18,""$#,##0"")",Failover Testing,Medium,Load testing in DR environment
Testing,Security Validation,Verify security controls and compliance in DR environment,EO Engineer,32,$175,"=TEXT(E19*F19,""$#,##0"")",Performance Validation,High,Compliance audit preparation
Testing,End-to-End Testing,Complete application functionality testing in DR mode,EO Engineer,56,$125,"=TEXT(E20*F20,""$#,##0"")",Security Validation,Medium,User acceptance in DR scenario
Documentation,DR Procedures Documentation,Create detailed disaster recovery runbooks and procedures,EO Engineer,48,$110,"=TEXT(E21*F21,""$#,##0"")",End-to-End Testing,Low,Include step-by-step recovery procedures
Documentation,Training Materials,Develop DR training materials for operations teams,EO Engineer,32,$130,"=TEXT(E22*F22,""$#,##0"")",DR Procedures Documentation,Low,Hands-on scenarios and simulations
Training,Operations Team Training,Train IT operations on DR procedures and tools,EO Engineer,40,$140,"=TEXT(E23*F23,""$#,##0"")",Training Materials,Medium,Include tabletop exercises
Training,Executive Briefing,Brief executive leadership on DR capabilities and procedures,EO Engineer,16,$200,"=TEXT(E24*F24,""$#,##0"")",Operations Team Training,Low,Decision-making during disasters
Transition,DR Operations Handover,Transfer DR operations to ongoing support teams,EO Engineer,24,$140,"=TEXT(E25*F25,""$#,##0"")",Executive Briefing,Low,Include 30-day support period
Transition,Documentation Review,Final review and approval of all DR documentation,EO Engineer,16,$120,"=TEXT(E26*F26,""$#,##0"")",DR Operations Handover,Low,Version control and change management
Transition,Lessons Learned,Conduct project retrospective and continuous improvement planning,EO Engineer,16,$140,"=TEXT(E27*F27,""$#,##0"")",Documentation Review,Low,Include recommendations for DR optimization
Management,Technical Leadership,Quarterback technical oversight and architecture review,EO Quarterback,284,$180,"=TEXT(E29*F29,""$#,##0"")",,Medium,25% of engineering effort
Management,Project Management,Project coordination and management activities,EO Project Manager,227,$150,"=TEXT(E30*F30,""$#,##0"")",,Low,20% of engineering effort
,,,     TOTAL HOURS,1048,   TOTAL COST,"=TEXT(E2*F2+E3*F3+E4*F4+E5*F5+E6*F6+E7*F7+E8*F8+E9*F9+E10*F10+E11*F11+E12*F12+E13*F13+E14*F14+E15*F15+E16*F16+E17*F17+E18*F18+E19*F19+E20*F20+E21*F21+E22*F22+E23*F23+E24*F24+E25*F25+E26*F26+E27*F27+E28*F28+E29*F29+E30*F30,""$#,##0"")",,,Total DR implementation cost estimate
