Communication ID,Communication Type,Audience,Purpose,Frequency,Format,Owner,Distribution Method,Meeting Duration,Agenda Topics,Key Stakeholders,Escalation Level,Success Metrics,Status,Next Scheduled,Notes
COMM-001,Executive Cloud Status,Executive Sponsors,Azure cloud project status and digital transformation progress,Weekly,Email Report,EO Project Manager,Email distribution list,N/A,"Cloud migration progress, cost optimization, key decisions needed",EO Quarterback and CTO,Executive,Report delivered on time and strategic decisions made,Active,[DATE],Include cloud adoption dashboard and ROI tracking
COMM-002,Cloud Steering Committee,Project Steering Committee,Strategic direction for Azure cloud adoption and governance,Bi-weekly,In-Person Meeting,EO Project Manager,Meeting invitation,60 minutes,"Cloud strategy, governance policies, budget, timeline, scope changes",EO Quarterback and IT Leadership,Strategic,Meeting attendance >80% and critical decisions documented,Active,[DATE],Decision authority for cloud governance and budget
COMM-003,Cloud Team Standup,Core Cloud Development Team,Daily coordination for Azure implementation and migration,Daily,Virtual Meeting,EO Quarterback,Video conference,15 minutes,"Azure deployment progress, migration status, technical blockers",Cloud Team and Azure Engineers,Operational,Daily attendance >90% and technical blockers resolved,Active,[DATE],Focus on cloud development coordination and impediments
COMM-004,Azure Architecture Review,Technical and Cloud Teams,Azure architecture and cloud optimization,Weekly,Technical Meeting,EO Quarterback,Meeting invitation,90 minutes,"Landing zone design, policies, network architecture",EO Sales Engineer (Solution Architecture) and Cloud Architects,Technical,Cloud decisions documented and performance targets achieved,Active,[DATE],Include Azure optimization results and governance metrics
COMM-005,Cloud Operations Review,Operations Team,Azure operations and management procedures,Bi-weekly,Operations Meeting,EO Quarterback,Meeting invitation,45 minutes,"Operational procedures, monitoring, cost management",EO Project Manager and EO Engineer (Technical Leadership),Management,Operations procedures updated and Azure-specific processes tracked,Active,[DATE],Focus on cloud operational excellence and cost optimization
COMM-010,Testing Coordination,QA and Testing Teams,Testing progress and quality validation,Weekly,QA Meeting,EO Quarterback,Meeting invitation,45 minutes,"Test execution, quality metrics, defect resolution",QA Team and Test Engineers,Quality,Quality gates met and testing within tolerance,Active,[DATE],Include testing metrics and quality validation results
COMM-011,Deployment Planning,Deployment Teams,Production deployment planning and coordination,Weekly,Deployment Meeting,EO Project Manager,Meeting invitation,60 minutes,"Deployment readiness, rollback procedures, go-live coordination",Deployment Team and Operations,Deployment,Deployment readiness achieved and procedures validated,Active,[DATE],Include deployment checklist and risk mitigation
COMM-012,Stakeholder Updates,Business Stakeholders,Business impact and readiness updates,Bi-weekly,Business Meeting,EO Sales Engineer,Meeting invitation,45 minutes,"Business readiness, training status, change management",Business Leaders and Change Management,Business,Business stakeholder engagement and readiness achieved,Active,[DATE],Include business impact assessment and training progress
