Question ID,Category,Sub-Category,Question,Guidance,Customer Response,Notes
BUS-001,Business Requirements,Project Information,What is the name of your SD-WAN transformation project?,"Provide internal project reference name","",Internal project reference for tracking
BUS-002,Business Requirements,Project Information,Who is the primary stakeholder for this WAN modernization?,"Name, role, and decision-making authority","",Main point of contact and decision authority
BUS-003,Business Requirements,Business Drivers,What challenges are driving SD-WAN adoption?,"Common challenges: High MPLS costs, Insufficient bandwidth, Slow site deployment, Poor cloud application performance, Inflexible WAN, Complex management","",Primary business driver for SD-WAN investment
BUS-004,Business Requirements,Current State,What is your current WAN architecture?,"Describe: MPLS circuits, Internet circuits, Hub-and-spoke topology, Point-to-point links, VPN overlay","",Current state baseline assessment
BUS-005,Business Requirements,Objectives,What are your primary goals for SD-WAN?,"Common goals: Reduce WAN costs, Increase bandwidth, Accelerate site deployment, Optimize cloud apps, Simplify management, Improve resilience","",Business objectives and expected outcomes
BUS-006,Business Requirements,Success Criteria,How will you measure SD-WAN success?,"Define KPIs: Cost savings %, Bandwidth increase, Site deployment time, Application performance SLA, WAN uptime %","",Success metrics for project evaluation
BUS-007,Business Requirements,Timeline,What is your expected timeline for SD-WAN deployment?,"Typical ranges: 0-6 months pilot, 6-12 months full deployment, 12-24 months phased migration","",Project timeline expectations and constraints
BUS-008,Business Requirements,Budget,What is your approved budget range for SD-WAN?,"Common ranges: $250K-500K, $500K-1M, $1M-3M, $3M+. Include hardware, circuits, software, services","",Budget constraints for solution sizing
BUS-009,Business Requirements,Cloud Strategy,What is your cloud adoption strategy?,"Strategy: Cloud-first SaaS adoption, Cloud migration in progress, Hybrid cloud, On-prem only, Multi-cloud","",Cloud connectivity requirements
BUS-010,Business Requirements,MPLS Contracts,When do current MPLS contracts expire?,"Contract status: Month-to-month, Expiring in 6 months, Expiring in 12 months, Long-term contract (2+ years), No MPLS","",Migration timing and contract implications
TECH-001,Technical Requirements,Site Count,How many branch office sites do you have?,"Typical ranges: 10-25, 25-50, 50-100, 100-250, 250+","",Site count drives router quantity and licensing
TECH-002,Technical Requirements,Site Growth,What is your expected site growth over 3 years?,"Growth: Current site count, projected additions per year, acquisitions expected","",Scalability requirements and capacity planning
TECH-003,Technical Requirements,Site Categorization,How would you categorize your sites?,"Categories: Large branches (100+ users), Medium branches (25-100 users), Small branches (<25 users), Retail/kiosks, Remote workers","",Site sizing and router selection
TECH-004,Technical Requirements,Current WAN Costs,What are your current annual WAN circuit costs?,"Costs: MPLS cost per site, Total annual MPLS spend, Internet circuit costs, Other WAN expenses","",ROI baseline for cost savings analysis
TECH-005,Technical Requirements,Current Bandwidth,What bandwidth does each site currently have?,"Bandwidth: MPLS (typical 5-20 Mbps), Internet (if dual-circuit), Bandwidth adequacy assessment","",Bandwidth requirements and upgrade needs
TECH-006,Technical Requirements,Bandwidth Requirements,What bandwidth do sites need with SD-WAN?,"Requirements: 50 Mbps, 100 Mbps, 250 Mbps, 500+ Mbps, Varies by site size","",Circuit sizing and cost optimization
TECH-007,Technical Requirements,Circuit Availability,What WAN circuit types are available at your sites?,"Circuits: Fiber (DIA), Cable broadband, DSL, Fixed wireless, LTE/5G, Starlink satellite","",Circuit diversity and availability assessment
TECH-008,Technical Requirements,WAN Design,What WAN topology do you prefer?,"Topology: Dual circuits per site (active-active), Broadband primary + LTE backup, Single circuit (cost-optimized), Mesh (any-to-any)","",WAN architecture and redundancy design
TECH-009,Technical Requirements,Hub Sites,How many hub sites or data centers do you have?,"Hub count: 1 data center, 2 data centers (HA), Regional hubs, No central hub (cloud-centric)","",Hub router sizing and architecture
TECH-010,Technical Requirements,Traffic Patterns,What are your primary traffic patterns?,"Patterns: Branch to data center, Branch to cloud (Office 365 AWS), Branch to branch, Internet breakout","",Application routing and policy requirements
TECH-011,Technical Requirements,Applications,What critical applications use the WAN?,"Applications: Office 365, Teams/Webex, Salesforce, SAP/ERP, VoIP, Video conferencing, File servers, Custom apps","",Application SLA policy requirements
TECH-012,Technical Requirements,Application Performance,What application SLA requirements do you have?,"SLAs: VoIP <100ms latency, Video <150ms, Mission-critical apps <50ms, Best-effort for web browsing","",SLA-based routing policy design
TECH-013,Technical Requirements,Cloud Platforms,What cloud platforms do you use?,"Platforms: AWS, Azure, Google Cloud, Oracle Cloud, SaaS only (Office 365 Salesforce), None","",Cloud on-ramp and direct connect requirements
TECH-014,Technical Requirements,Cloud Connectivity,Do you need dedicated cloud connectivity?,"Options: Cloud on-ramps (Equinix Megaport), VPN to cloud, Public internet only, ExpressRoute/Direct Connect","",Cloud integration architecture
TECH-015,Technical Requirements,Routing Protocol,What routing protocol do you currently use?,"Protocols: BGP, OSPF, EIGRP, Static routes, None (single circuit)","",SD-WAN routing integration requirements
TECH-016,Technical Requirements,QoS Requirements,What QoS and traffic prioritization is needed?,"QoS: VoIP/video priority, Business-critical apps, Bulk data transfer, Guest internet, Application-based QoS","",Traffic shaping and prioritization policies
TECH-017,Technical Requirements,Multicast,Do you require multicast support?,"Multicast use cases: Video distribution, Real-time collaboration, Surveillance cameras, Not required","",Multicast overlay requirements
TECH-018,Technical Requirements,IPv6,Do you require IPv6 support?,"IPv6: Required for all sites, Dual-stack (IPv4+IPv6), IPv4 only, Future requirement","",IP addressing architecture
SEC-001,Security & Compliance,Security Requirements,What security controls are required on SD-WAN?,"Controls: Integrated firewall, IPS/IDS, URL filtering, Malware protection, DDoS mitigation, VPN encryption","",Security architecture and integration
SEC-002,Security & Compliance,Firewall,What firewall approach do you prefer?,"Approach: Integrated firewall on SD-WAN routers, Separate firewall appliances, Cloud-delivered firewall (SASE), Umbrella DNS security","",Security service insertion strategy
SEC-003,Security & Compliance,VPN Encryption,What VPN encryption requirements apply?,"Encryption: IPsec for all WAN traffic, Opportunistic encryption, No encryption (trusted MPLS), Per-application encryption","",Data protection and encryption policy
SEC-004,Security & Compliance,Internet Breakout,What is your local internet breakout strategy?,"Breakout: Direct internet at branches for SaaS, Backhauled to data center, Selective based on application, Cloud proxy (Zscaler Umbrella)","",Security and internet access architecture
SEC-005,Security & Compliance,Zero Trust,Are you implementing Zero Trust Network Access (ZTNA)?,"ZTNA: Planned with SD-WAN, Future initiative, Not planned, Already have VPN solution","",Zero trust integration requirements
SEC-006,Security & Compliance,Compliance Standards,What compliance standards apply to WAN?,"Standards: PCI DSS, HIPAA, SOC 2, ISO 27001, NIST 800-53, Federal regulations","",Compliance controls and audit requirements
SEC-007,Security & Compliance,DLP,Do you require Data Loss Prevention (DLP)?,"DLP: Integrated DLP on SD-WAN, Cloud DLP service, Not required, Future requirement","",Data protection and DLP integration
SEC-008,Security & Compliance,Audit Logging,What audit and logging requirements apply?,"Requirements: WAN traffic logs, Security event logs, Policy changes, Performance metrics, SIEM integration, Retention period","",Audit trail and compliance reporting
OPS-001,Operations & Support,Team Size,How many network engineers support the WAN?,"Team size: 1-2 engineers, 3-5 engineers, 6-10 engineers, Distributed regional teams","",Staffing and support model assessment
OPS-002,Operations & Support,Expertise,What is your team's SD-WAN experience?,"Experience: None - new to SD-WAN, Basic understanding, SD-WAN pilot experience, Multi-vendor SD-WAN, Cisco SD-WAN certified","",Training needs and enablement planning
OPS-003,Operations & Support,Management Preference,What SD-WAN management model do you prefer?,"Models: Self-managed vManage, Cisco-managed service, Partner-managed (MSP), Hybrid co-managed","",Management and operations model
OPS-004,Operations & Support,NOC Integration,How does SD-WAN integrate with your NOC?,"NOC: Centralized NOC with monitoring tools, Regional NOCs, Outsourced NOC (MSP), No formal NOC","",Monitoring and incident management
OPS-005,Operations & Support,Monitoring Tools,What network monitoring tools are in use?,"Tools: SolarWinds, PRTG, Cisco Prime, DNA Center, ThousandEyes, Datadog, Other","",Monitoring ecosystem integration
OPS-006,Operations & Support,Troubleshooting,What troubleshooting capabilities do you need?,"Capabilities: Application path visibility, Packet capture, WAN optimization insights, Real-time performance dashboards, Historical trending","",Operational visibility requirements
OPS-007,Operations & Support,Change Management,What change management processes apply?,"Processes: CAB approval for policy changes, Maintenance windows, Staged rollout, Emergency change process","",Change control and governance
OPS-008,Operations & Support,Support Model,What support coverage is required?,"Support: Business hours (8x5), Extended (24x5), Full (24x7), Cisco TAC, Partner support","",Support SLA and escalation procedures
OPS-009,Operations & Support,Site Deployment,How are new sites typically deployed?,"Deployment: IT visits site, Local technician, Ship-and-install, Zero-touch (plug-and-play)","",Deployment model and logistics
OPS-010,Operations & Support,Disaster Recovery,What DR requirements apply to WAN?,"DR: Automatic failover to backup circuit, Manual failover, Geographic redundancy, RTO/RPO targets","",Business continuity and failover requirements
IMPL-001,Implementation Planning,Resources,Who will be the technical lead for this SD-WAN project?,"Name, role, contact information","",Technical ownership and project management
IMPL-002,Implementation Planning,Team Availability,What internal resources are available for SD-WAN deployment?,"List team members, roles, time commitment (hours per week)","",Resource planning and project timeline feasibility
IMPL-003,Implementation Planning,Migration Strategy,What is your preferred SD-WAN migration approach?,"Options: Pilot 3-5 sites, Phased regional rollout, Site-by-site replacement, Parallel run with MPLS, Overlay then cutover","",Implementation strategy and risk mitigation
IMPL-004,Implementation Planning,Pilot Sites,Which sites should be in the SD-WAN pilot?,"Pilot criteria: Low-risk sites, Varied site sizes, Representative applications, Friendly users, IT-staffed locations","",Pilot scope and success criteria
IMPL-005,Implementation Planning,Cutover Approach,What cutover approach do you prefer for each site?,"Cutover: Hard cutover (immediate), Parallel run (weeks), Gradual migration, Application-by-application, Business hours only","",Migration methodology and user impact
IMPL-006,Implementation Planning,Circuit Procurement,Who handles circuit procurement and installation?,"Procurement: Internal telecom team, Outsourced to partner, Cisco managed service, Carrier relationship","",Circuit logistics and lead times
IMPL-007,Implementation Planning,Hardware Shipping,How should routers be shipped and staged?,"Shipping: Direct to site, Staged at depot, Pre-configured and shipped, Ship from vendor, Kitting and labeling","",Logistics and deployment efficiency
IMPL-008,Implementation Planning,Zero-Touch,Do you want zero-touch provisioning (ZTP)?,"ZTP: Yes for all sites, Pilot only, Manual config preferred, Hybrid (ZTP for branches manual for hubs)","",Deployment automation level
IMPL-009,Implementation Planning,Training Needs,What training is needed for network team?,"Training: SD-WAN architecture, vManage operations, Policy configuration, Troubleshooting, Advanced features, Certification prep","",Knowledge transfer scope and timeline
IMPL-010,Implementation Planning,Documentation,What documentation standards apply?,"Documentation: Architecture diagrams, Policy definitions, Runbooks, Site cutover plans, Troubleshooting guides, As-built documentation","",Documentation scope and deliverables
RISK-001,Risk & Constraints,Implementation Risks,What are your main concerns about SD-WAN deployment?,"Concerns: Site downtime, Application performance, Circuit availability, Team readiness, Budget overruns, Timeline delays","",Primary implementation concerns and risk factors
RISK-002,Risk & Constraints,Business Impact,What is the impact of site WAN outages?,"Impact: Revenue loss, Customer impact, Operational disruption, Regulatory issues, Reputational damage","",Failure impact and mitigation requirements
RISK-003,Risk & Constraints,Circuit Procurement,What concerns exist about circuit procurement?,"Concerns: Lead times (60-120 days), Availability at remote sites, Carrier reliability, Contract lock-in, Cost variability","",Circuit logistics and dependencies
RISK-004,Risk & Constraints,Application Performance,What concerns exist about application performance?,"Concerns: VoIP quality degradation, Video conferencing issues, ERP responsiveness, Database performance, User experience","",Performance validation and testing requirements
RISK-005,Risk & Constraints,Skill Gaps,What skill gaps exist for supporting SD-WAN?,"Skill gaps: SD-WAN architecture, vManage operations, Application-aware routing, Troubleshooting, Security integration, Cloud connectivity","",Training and hiring requirements
RISK-006,Risk & Constraints,Dependencies,What external dependencies exist for this project?,"Dependencies: MPLS contract expirations, Circuit installations, Budget approvals, M&A activity, Other IT projects, Vendor availability","",Project dependencies and critical path items
RISK-007,Risk & Constraints,Constraints,What constraints must the SD-WAN solution work within?,"Constraints: Budget limits, Timeline, MPLS contract lock-in, Circuit availability, Organizational policies, Skill availability","",Solution design boundaries and constraints
