Parameter Name,Category,Environment,Default Value,Description,Required,Data Type,Validation Rules,Security Level,Owner Team,Dependencies,Notes,Last Updated
APP_NAME,Application,All,[Solution Name],Application identifier for logging and monitoring,Yes,String,Max 50 characters,Public,Development,None,Used in logs and metrics,[DATE]
APP_VERSION,Application,All,1.0.0,Current application version,Yes,String,Semantic versioning format,Public,Development,None,Updated with each release,[DATE]
APP_ENVIRONMENT,Application,All,development,Deployment environment identifier,Yes,String,development|staging|production,Public,Operations,None,Controls feature flags and logging,[DATE]
APP_PORT,Application,All,8080,Port number for application server,Yes,Integer,1024-65535,Public,Infrastructure,Network configuration,Ensure no port conflicts,[DATE]
APP_LOG_LEVEL,Application,All,info,Logging verbosity level,Yes,String,debug|info|warn|error,Public,Operations,Monitoring tools,Production should use warn or error,[DATE]
DB_HOST,Database,All,[database-host],Database server hostname or IP,Yes,String,Valid hostname or IP,Confidential,Database Team,Network connectivity,Use FQDN for production,[DATE]
DB_PORT,Database,All,5432,Database server port,Yes,Integer,1-65535,Public,Database Team,Firewall rules,PostgreSQL default port,[DATE]
DB_NAME,Database,All,[database-name],Database name to connect to,Yes,String,Valid database identifier,Confidential,Database Team,Database creation,Must exist before deployment,[DATE]
DB_USERNAME,Database,All,[username],Database connection username,Yes,String,Valid username format,Secret,Database Team,User creation,Use service account,[DATE]
DB_PASSWORD,Database,All,[password],Database connection password,Yes,String,Min 12 chars with complexity,Secret,Database Team,User creation,Store in secrets manager,[DATE]
DB_SSL_MODE,Database,Production,require,SSL connection requirement,Yes,String,disable|allow|prefer|require,Confidential,Security Team,SSL certificates,Always require for production,[DATE]
DB_POOL_MIN,Database,All,5,Minimum database connections in pool,Yes,Integer,1-100,Public,Database Team,DB_POOL_MAX,Tune based on load patterns,[DATE]
DB_POOL_MAX,Database,All,20,Maximum database connections in pool,Yes,Integer,5-500,Public,Database Team,DB_POOL_MIN,Monitor connection usage,[DATE]
CACHE_HOST,Cache,All,[cache-host],Redis cache server hostname,Yes,String,Valid hostname or IP,Confidential,Infrastructure,Network connectivity,Use Redis cluster for HA,[DATE]
CACHE_PORT,Cache,All,6379,Redis cache server port,Yes,Integer,1-65535,Public,Infrastructure,Firewall rules,Redis default port,[DATE]
CACHE_PASSWORD,Cache,All,[password],Redis authentication password,No,String,Min 8 characters,Secret,Infrastructure,Redis configuration,Optional if Redis AUTH disabled,[DATE]
CACHE_TTL,Cache,All,3600,Default cache time-to-live in seconds,Yes,Integer,60-86400,Public,Development,Cache strategy,Tune based on data patterns,[DATE]
JWT_SECRET,Security,All,[jwt-secret-key],Secret key for JWT token signing,Yes,String,Min 32 chars base64,Secret,Security Team,Authentication,Rotate regularly,[DATE]
ENCRYPTION_KEY,Security,All,[encryption-key],Key for data encryption at rest,Yes,String,256-bit key base64,Secret,Security Team,Encryption service,Use key management service,[DATE]
API_KEY,Security,All,[api-key],API authentication key,Yes,String,UUID or secure random,Secret,API Team,External services,Unique per environment,[DATE]
CORS_ORIGINS,Security,All,[allowed-origins],Allowed CORS origins,Yes,String,Comma-separated URLs,Confidential,Security Team,Frontend domains,Restrict to known domains,[DATE]
SERVICE_ENDPOINT,Integration,All,[external-service-url],External service API endpoint,Yes,String,Valid HTTPS URL,Confidential,Integration Team,Service availability,Use load balancer URL,[DATE]
SERVICE_API_KEY,Integration,All,[service-api-key],API key for external service,Yes,String,Provider-specific format,Secret,Integration Team,Service registration,Obtain from service provider,[DATE]
SERVICE_TIMEOUT,Integration,All,30000,Service call timeout in milliseconds,Yes,Integer,1000-300000,Public,Integration Team,Network latency,Adjust based on SLA,[DATE]
METRICS_ENABLED,Monitoring,All,true,Enable metrics collection,Yes,Boolean,true|false,Public,Operations,Monitoring tools,Always enable for production,[DATE]
HEALTH_CHECK_PATH,Monitoring,All,/health,Health check endpoint path,Yes,String,Valid URL path,Public,Operations,Load balancer,Must return 200 for healthy,[DATE]
PROMETHEUS_PORT,Monitoring,All,9090,Port for Prometheus metrics,Yes,Integer,1024-65535,Public,Operations,Monitoring stack,Ensure port availability,[DATE]
VPC_CIDR,Network,All,10.0.0.0/16,VPC CIDR block,Yes,String,Valid CIDR notation,Public,Network Team,IP planning,Plan for future growth,[DATE]
PUBLIC_SUBNET_1,Network,All,10.0.1.0/24,First public subnet CIDR,Yes,String,Valid CIDR notation,Public,Network Team,VPC_CIDR,Must be within VPC CIDR,[DATE]
PUBLIC_SUBNET_2,Network,All,10.0.2.0/24,Second public subnet CIDR,Yes,String,Valid CIDR notation,Public,Network Team,VPC_CIDR,Different AZ from subnet 1,[DATE]
PRIVATE_SUBNET_1,Network,All,10.0.10.0/24,First private subnet CIDR,Yes,String,Valid CIDR notation,Public,Network Team,VPC_CIDR,Must be within VPC CIDR,[DATE]
PRIVATE_SUBNET_2,Network,All,10.0.11.0/24,Second private subnet CIDR,Yes,String,Valid CIDR notation,Public,Network Team,VPC_CIDR,Different AZ from subnet 1,[DATE]
DB_SUBNET_1,Network,All,10.0.20.0/24,First database subnet CIDR,Yes,String,Valid CIDR notation,Public,Network Team,VPC_CIDR,Isolated database tier,[DATE]
DB_SUBNET_2,Network,All,10.0.21.0/24,Second database subnet CIDR,Yes,String,Valid CIDR notation,Public,Network Team,VPC_CIDR,Different AZ from subnet 1,[DATE]
BACKUP_RETENTION,Operations,All,30,Backup retention period in days,Yes,Integer,7-365,Public,Operations,Backup strategy,Comply with data policies,[DATE]
BACKUP_SCHEDULE,Operations,All,0 2 * * *,Backup schedule in cron format,Yes,String,Valid cron expression,Public,Operations,Backup service,Daily at 2 AM UTC,[DATE]
LOG_RETENTION,Operations,All,90,Log retention period in days,Yes,Integer,30-365,Public,Operations,Log management,Balance cost and compliance,[DATE]
SCALING_MIN_INSTANCES,Operations,All,2,Minimum number of instances,Yes,Integer,1-10,Public,Operations,Load balancer,Ensure high availability,[DATE]
SCALING_MAX_INSTANCES,Operations,All,10,Maximum number of instances,Yes,Integer,5-100,Public,Operations,Cost management,Set based on peak load,[DATE]
SCALING_TARGET_CPU,Operations,All,70,CPU threshold for auto-scaling,Yes,Integer,50-90,Public,Operations,Performance monitoring,Tune based on application behavior,[DATE]