Question ID,Category,Sub-Category,Question,Guidance,Customer Response,Notes
BUS-001,Business Requirements,Project Information,What is the name of your VxRail Enterprise HCI project?,"Provide internal project reference name","",Internal project reference for tracking
BUS-002,Business Requirements,Project Information,Who is the primary stakeholder for this enterprise HCI infrastructure project?,"Name, role, and decision-making authority","",Main point of contact and decision authority
BUS-003,Business Requirements,Business Drivers,What mission-critical infrastructure challenges require enterprise HCI?,"Common challenges: Tier 1 database performance, Business continuity, Aging SAN refresh, Complex DR orchestration, Multi-site deployments, Strict SLA requirements","",Primary business driver for enterprise HCI investment
BUS-004,Business Requirements,Current State,What is your current enterprise infrastructure for mission-critical workloads?,"Describe hypervisor, enterprise SAN (EMC VMAX/Unity, NetApp, Pure), server count, and pain points","",Current state baseline assessment
BUS-005,Business Requirements,VM Count,How many virtual machines do you run for Tier 1 applications?,"Typical ranges: 200-500, 501-1000, 1001-2000, 2000+","",Determines cluster sizing and capacity planning
BUS-006,Business Requirements,Critical Workloads,What mission-critical workloads will you run on VxRail?,"Tier 1 workloads: Oracle RAC databases, SQL Server Always-On clusters, SAP HANA, SAP S/4HANA, Epic EHR, Cerner, Business intelligence platforms, Core banking systems","",Workload classification drives performance requirements
BUS-007,Business Requirements,Objectives,What are your primary goals for deploying enterprise hyperconverged infrastructure?,"Common goals: Meet strict SLAs (99.99% uptime), Accelerate disaster recovery, Simplify multi-site operations, Reduce infrastructure costs, Eliminate SAN complexity, Enable micro-segmentation","",Business objectives and expected outcomes
BUS-008,Business Requirements,Success Criteria,How will you measure enterprise VxRail HCI deployment success?,"Define KPIs: SLA achievement (99.99%), RTO/RPO targets, database transaction performance, infrastructure cost reduction, DR failover time","",Success metrics for project evaluation
BUS-009,Business Requirements,SLA Requirements,What uptime SLA must you achieve for mission-critical applications?,"Common targets: 99.9% (8.76 hours downtime/year), 99.95% (4.38 hours/year), 99.99% (52 minutes/year), 99.995% (26 minutes/year)","",Availability architecture and redundancy requirements
BUS-010,Business Requirements,Budget,What is your approved budget range for enterprise HCI infrastructure?,"Common ranges: $500K-$1M (8-node), $1M-$2M (12-16 node), $2M-$5M (24-32 node). Include both CapEx and OpEx","",Budget constraints for solution sizing
BUS-011,Business Requirements,Multi-Site,Do you have multiple data centers for geographic distribution?,"Multi-site enables disaster recovery, compliance, and performance optimization","",Geographic distribution and DR strategy
BUS-012,Business Requirements,Growth Projections,How do you expect mission-critical workload growth over 3 years?,"Provide current capacity and projected annual growth rate for Tier 1 applications","",Scalability requirements and expansion planning
TECH-001,Technical Requirements,Performance Tier,What storage performance tier is required for mission-critical workloads?,"VxRail P570: All-NVMe for 100,000+ IOPS. VxRail V570: Hybrid NVMe+SSD for balanced performance","",Storage tier selection and cost optimization
TECH-002,Technical Requirements,IOPS Requirements,What storage IOPS do your mission-critical databases require?,"Oracle RAC: 50,000+ IOPS typical. SQL Always-On: 30,000-100,000 IOPS. SAP HANA: 100,000+ IOPS","",Storage performance validation and sizing
TECH-003,Technical Requirements,Latency Requirements,What storage latency targets must you meet for Tier 1 applications?,"Common targets: <1ms for OLTP databases, <2ms for virtualized desktops, <5ms for general workloads","",All-NVMe vs hybrid storage decision
TECH-004,Technical Requirements,Storage Capacity,What is your total usable storage capacity requirement for enterprise workloads?,"Include current usage plus 3-year growth. Common ranges: 100-200TB, 200-500TB, 500TB-1PB, 1PB+","",vSAN capacity sizing (account for FTT=2 overhead)
TECH-005,Technical Requirements,Failure Tolerance,What level of hardware failure tolerance do you require?,"Options: FTT=1 (tolerate 1 node failure, minimum 4 nodes), FTT=2 (tolerate 2 node failures, minimum 6 nodes). Enterprise typically requires FTT=2","",vSAN failure tolerance policy and cluster sizing
TECH-006,Technical Requirements,Cluster Size,What cluster size is optimal for your enterprise deployment?,"Common: 8-node (balanced), 12-16 node (high performance), 24-32 node (scale-out)","",Performance and redundancy tradeoffs
TECH-007,Technical Requirements,Deduplication,What deduplication and compression ratios do you expect?,"vSAN Enterprise: 2-3:1 typical for VMs, 3-5:1 for VDI. Lower ratios for databases (pre-compressed data)","",Effective capacity calculation and sizing
TECH-008,Technical Requirements,Database Workloads,What database platforms require high performance?,"Common: Oracle Database 12c/19c, Microsoft SQL Server 2016-2022, SAP HANA, PostgreSQL, MongoDB, Cassandra","",Database-specific tuning and configuration
TECH-009,Technical Requirements,Oracle RAC,Do you run Oracle Real Application Clusters (RAC)?,"Oracle RAC requires low-latency shared storage. vSAN all-NVMe recommended for RAC performance","",Oracle RAC certification and performance validation
TECH-010,Technical Requirements,SQL Always-On,Do you run SQL Server Always-On Availability Groups?,"SQL Always-On benefits from low-latency storage and high IOPS for synchronous replication","",SQL Server optimization and storage policies
TECH-011,Technical Requirements,SAP HANA,Do you run SAP HANA or S/4HANA in-memory databases?,"SAP HANA requires all-NVMe with strict latency requirements. VxRail P570 certified for SAP HANA","",SAP HANA certification and TDI compliance
TECH-012,Technical Requirements,Memory Capacity,What total RAM capacity is required for in-memory databases?,"SAP HANA nodes: 1.5TB-3TB per node. Large database VMs: 512GB-1TB per VM","",Memory sizing for database consolidation
TECH-013,Technical Requirements,vSphere Version,What VMware version requirements do you have for enterprise features?,"VxRail ships with vSphere 8. Enterprise needs DRS, HA, vMotion, Fault Tolerance","",Version compatibility and enterprise feature requirements
TECH-014,Technical Requirements,Network Speed,What network connectivity is required for vSAN and vMotion?,"VxRail P570 uses 25GbE for vSAN. Consider 100GbE for very large databases and high vMotion traffic","",Network infrastructure and switch requirements
TECH-015,Technical Requirements,NSX Integration,Do you need VMware NSX for micro-segmentation and network virtualization?,"NSX enables East-West firewall for database security and zero-trust architecture","",NSX Data Center licensing and architecture
TECH-016,Technical Requirements,Disaster Recovery,What disaster recovery solution do you require?,"Options: VMware Site Recovery Manager (SRM), vSAN stretched cluster, Dell RecoverPoint for VMs, Zerto","",DR solution selection and RPO/RTO requirements
TECH-017,Technical Requirements,RTO/RPO,What are your Recovery Time Objective (RTO) and Recovery Point Objective (RPO)?,"Mission-critical: RTO <15 minutes, RPO <5 minutes. Consider synchronous replication for RPO near-zero","",DR architecture and replication technology
TECH-018,Technical Requirements,Stretched Cluster,Do you need vSAN stretched cluster for active-active DR?,"Stretched cluster: Zero RPO, automated failover. Requires <5ms RTT latency between sites","",Geographic distribution and network latency
TECH-019,Technical Requirements,Backup,What enterprise backup solution do you use?,"Common: Dell EMC PowerProtect Data Manager (PPDM), Veeam, Commvault, Rubrik, Cohesity, IBM Spectrum Protect","",Backup architecture and integration requirements
TECH-020,Technical Requirements,Backup Performance,What backup window and throughput requirements apply?,"Enterprise backup: Complete within 4-8 hour window. Consider Changed Block Tracking (CBT) for incrementals","",Backup target sizing and network capacity
SEC-001,Security & Compliance,Data Classification,What is the highest data classification for enterprise applications?,"Levels: Public, Internal, Confidential, Restricted, PII/PHI, PCI cardholder data, CUI/ITAR","",Determines encryption and access control requirements
SEC-002,Security & Compliance,Encryption,Do you require encryption at rest for mission-critical data?,"vSAN encryption with external KMS required for compliance (FIPS 140-2 validated)","",Security architecture and key management
SEC-003,Security & Compliance,Key Management,What key management solution will you use for vSAN encryption?,"Options: VMware vCenter Native KMS, HashiCorp Vault Enterprise, Thales CipherTrust Manager, AWS CloudHSM (hybrid)","",KMS integration and HA requirements
SEC-004,Security & Compliance,Compliance Standards,What compliance standards must the enterprise infrastructure meet?,"Common: SOC 2 Type II, ISO 27001, HIPAA, PCI DSS Level 1, FedRAMP High, NIST 800-53, GDPR, CMMC Level 3","",Compliance controls and audit requirements
SEC-005,Security & Compliance,Micro-Segmentation,Do you need application-level micro-segmentation for zero-trust?,"NSX-T micro-segmentation enables granular firewall policies between database tiers","",NSX deployment and security policy design
SEC-006,Security & Compliance,Intrusion Detection,Do you need distributed IDS/IPS for East-West traffic?,"NSX Distributed IDS/IPS inspects lateral movement and threats between VMs","",Security architecture and NSX services
SEC-007,Security & Compliance,STIG Compliance,Do you require DISA STIG compliance for government workloads?,"VMware provides STIG hardening guides. VxRail supports STIG-compliant ESXi configuration","",Government compliance and hardening requirements
SEC-008,Security & Compliance,Audit Logging,What audit and logging requirements do you have for compliance?,"Requirements: vCenter audit logs, ESXi shell access logs, vSAN health logs, Configuration change tracking, Integration with SIEM","",Audit trail and compliance reporting needs
HA-001,High Availability & DR,Availability SLA,What uptime SLA must you guarantee for mission-critical applications?,"Enterprise SLA: 99.99% (52 min downtime/year), 99.995% (26 min/year). Requires FTT=2 and redundant infrastructure","",HA architecture and SLA contractual obligations
HA-002,High Availability & DR,Planned Downtime,Can you tolerate planned downtime for maintenance?,"vSAN and vSphere support rolling updates with zero downtime. VxRail Lifecycle Manager automates patching","",Maintenance windows and change management
HA-003,High Availability & DR,Fault Domains,Do you need vSAN fault domains for rack-level failure protection?,"Fault domains: Protect against entire rack failure (power, network, cooling). Requires 3+ fault domains","",Physical distribution and rack diversity
HA-004,High Availability & DR,DR Site,Do you have a secondary data center for disaster recovery?,"DR site enables business continuity. Distance and latency affect replication technology choice","",Geographic DR and site-to-site connectivity
HA-005,High Availability & DR,DR Failover,What DR failover approach do you require?,"Options: Manual failover (RPO hours), Automated failover with SRM (RPO <15 min), Synchronous stretched cluster (RPO zero)","",DR automation and testing procedures
HA-006,High Availability & DR,DR Testing,How frequently do you test disaster recovery failover?,"Compliance often requires quarterly or annual DR tests. SRM enables non-disruptive testing","",DR testing and compliance validation
HA-007,High Availability & DR,Multi-Site Replication,Do you need replication between 3+ sites?,"Multi-site enables: DR to secondary, backup to tertiary. RecoverPoint for VMs supports many-to-many","",Complex replication topology and orchestration
HA-008,High Availability & DR,Application HA,What application-level HA do you use?,"Application clusters: Oracle RAC, SQL Always-On, Kubernetes, Pacemaker/Corosync. Complements infrastructure HA","",Application and infrastructure HA coordination
OPS-001,Operations & Support,Management Platform,What centralized management platform do you use?,"Options: vRealize Operations (vROps), vRealize Suite, Third-party (SolarWinds, PRTG), Dell OpenManage Enterprise","",Monitoring integration and alerting strategy
OPS-002,Operations & Support,Monitoring Requirements,What monitoring and alerting is required for mission-critical infrastructure?,"Enterprise monitoring: Real-time dashboards, Predictive analytics, Capacity planning, Performance anomaly detection","",Operational visibility and proactive management
OPS-003,Operations & Support,Automation,Do you use infrastructure automation or orchestration?,"Tools: Ansible Tower, Terraform Enterprise, VMware vRealize Automation, PowerCLI scripts","",Automation integration and API requirements
OPS-004,Operations & Support,ITSM Integration,What ITSM platform do you use for ticketing?,"Common: ServiceNow, BMC Remedy, Jira Service Management. Integration for automated incident creation","",ITSM integration and workflow automation
OPS-005,Operations & Support,Support Coverage,What Dell support coverage do you require for mission-critical?,"Mission Critical Services: 2-hour response 24x7 with on-site parts. ProSupport Plus: 4-hour response","",Support SLA and cost tradeoff for Tier 1 apps
OPS-006,Operations & Support,Escalation,Do you need dedicated technical account manager (TAM)?,"TAM provides proactive support, quarterly reviews, escalation management for enterprise customers","",Enterprise support and relationship management
OPS-007,Operations & Support,Capacity Planning,How do you manage capacity planning for growth?,"vRealize Operations provides capacity planning and what-if analysis. Plan 18-24 months ahead for CapEx","",Capacity management and budget planning
OPS-008,Operations & Support,Performance Management,What performance management processes are in place?,"Database performance monitoring: Real-time query analysis, Storage I/O profiling, CPU/memory trending","",Performance optimization and tuning procedures
OPS-009,Operations & Support,Runbooks,Do you need operational runbooks for VxRail enterprise operations?,"Enterprise runbooks: Incident response, Escalation procedures, Disaster recovery, Change management, Compliance audits","",Documentation requirements and knowledge transfer
OPS-010,Operations & Support,24x7 Operations,Do you have 24x7 operations staff for monitoring?,"24x7 NOC: Proactive monitoring and incident response. Automation reduces staffing needs","",Operational model and staffing requirements
IMPL-001,Implementation Planning,Deployment Size,What is the planned VxRail deployment size?,"Typical enterprise: 8-12 node pilot, 24-32 node production. Staged deployment reduces risk","",Phased deployment and pilot approach
IMPL-002,Implementation Planning,Pilot Workloads,What pilot workloads will you use to validate VxRail enterprise platform?,"Non-production databases, development environments, or lower-tier applications for validation","",Pilot selection and risk mitigation
IMPL-003,Implementation Planning,Migration Timeline,What is your timeline for migrating mission-critical workloads?,"Phased migration: Pilot 1-2 months, production tiers 3-6 months. Oracle RAC requires careful planning","",Migration scheduling and business impact
IMPL-004,Implementation Planning,Database Migration,What database migration approach will you use?,"Options: vMotion (VMware-to-VMware zero downtime), Storage vMotion, Backup/restore, Oracle Data Guard failover","",Database migration tools and downtime windows
IMPL-005,Implementation Planning,Downtime Windows,What maintenance windows are acceptable for Tier 1 migrations?,"Mission-critical: Minimal or zero downtime required. Use vMotion or application-level HA for cutover","",Migration scheduling and business constraints
IMPL-006,Implementation Planning,Training Needs,What training is required for VxRail enterprise administration?,"Advanced training: vSAN specialist, NSX professional, vRealize Operations, VxRail lifecycle management","",Knowledge transfer scope and certification paths
IMPL-007,Implementation Planning,Professional Services,Do you need Dell ProDeploy Enterprise Services?,"ProDeploy Enterprise: Architecture design, installation, migration services, knowledge transfer","",Dell professional services and engagement scope
IMPL-008,Implementation Planning,Performance Validation,What performance testing is required before production go-live?,"Database benchmarks: TPC-C equivalent, Oracle SLOB, SQL Server DiskSpd, SAP HANA certification tests","",Acceptance criteria and performance validation
RISK-001,Risk & Constraints,Complexity,What concerns do you have about enterprise HCI complexity?,"VxRail simplifies operations but still requires VMware expertise. Training and support critical","",Skill development and change management
RISK-002,Risk & Constraints,Migration Risk,What could cause mission-critical migration to fail?,"Database migration risks: Performance degradation, Compatibility issues, Downtime overruns, Data corruption","",Risk mitigation and rollback planning
RISK-003,Risk & Constraints,Performance Risk,How will you validate performance meets Tier 1 SLAs?,"Pilot testing, benchmarking, and gradual production cutover validate performance before full commitment","",Performance acceptance and SLA validation
COST-001,Cost Comparison,Legacy Costs,What are your current enterprise SAN and server costs?,"Include: EMC/NetApp maintenance, server support, power, rack space, admin labor for enterprise storage","",ROI baseline for cost comparison analysis
COST-002,Cost Comparison,SAN Refresh,What would legacy SAN refresh cost vs VxRail HCI?,"Enterprise SAN refresh: $1M-$3M for equivalent capacity. Compare to VxRail all-inclusive model","",Alternative investment and TCO comparison
COST-003,Cost Comparison,ROI Expectations,What ROI timeline and payback period are you targeting for enterprise HCI?,"Enterprise HCI TCO benefits: 18-36 month payback typical. Operational simplification delivers ongoing value","",Financial justification and approval thresholds
