Communication Type,Audience,Frequency,Channel,Responsible Party,Content,Format,Success Metrics
"Project Kickoff",All Stakeholders,One-time,Town Hall Meeting,Project Manager,"Project overview, HashiCorp strategy, timeline, team roles",Presentation and Q&A,100% stakeholder attendance
"Weekly Sprint Updates",Development Teams,Weekly,Slack/Email,Scrum Master,"Sprint progress, module development, blockers, upcoming deliverables",Agile status update,95% team engagement
"Executive Dashboard",C-Level Executives,Bi-weekly,Executive Portal,Program Manager,"Platform adoption, cost savings, risk status, milestone progress",Executive dashboard,Executive satisfaction >4.0
"Architecture Reviews",Technical Leads,Weekly,Architecture Committee,Solution Architect,"Module designs, policy frameworks, integration patterns, security reviews",Technical documentation,Architecture approval <48 hours
"HashiCorp Collaboration",HashiCorp Partners,Monthly,Partner Meetings,Technical Lead,"Platform optimization, roadmap alignment, support escalations, best practices",Partnership review,Partner satisfaction >95%
"Infrastructure Teams",Engineering Teams,Bi-weekly,Engineering Forums,Platform Engineer,"Platform capabilities, new modules, training opportunities, best practices",Technical workshops,Knowledge transfer >85%
"Policy and Governance",Compliance Team,Monthly,Governance Committee,Compliance Officer,"Policy updates, compliance status, audit preparations, control effectiveness",Governance dashboard,Compliance score >98%
"Cost Management",Finance Team,Monthly,Financial Reviews,FinOps Manager,"Cost analysis, budget performance, optimization opportunities, ROI metrics",Financial dashboard,Budget variance <3%
"User Training",End Users,Ongoing,Learning Platform,Training Manager,"Terraform skills, platform features, certification paths, hands-on labs",Training portal,Certification rate >80%
"Platform Operations",Operations Team,Daily,Operations Channel,Platform Administrator,"Platform health, performance metrics, incidents, maintenance activities",Operations dashboard,SLA compliance >99.5%
"Change Communications",All Users,As needed,Platform Notifications,Change Manager,"Platform updates, new features, maintenance windows, policy changes",Notification system,User awareness >95%
"Security Updates",Security Team,Weekly,Security Committee,Security Engineer,"Security assessments, vulnerability reports, policy compliance, threat intelligence",Security briefing,Security posture >95%
"Module Development",Module Authors,Weekly,Developer Community,Module Lead,"Module standards, code reviews, testing requirements, publication guidelines",Developer portal,Module quality >90%
"Vendor Management",Procurement Team,Quarterly,Vendor Reviews,Vendor Manager,"License management, contract performance, renewal planning, cost optimization",Vendor scorecard,Vendor performance >95%
"Risk Management",Risk Committee,Monthly,Risk Reviews,Risk Manager,"Risk assessments, mitigation strategies, incident analysis, control effectiveness",Risk dashboard,Risk score <Medium
"Business Value",Business Sponsors,Quarterly,Business Reviews,Business Analyst,"Value realization, productivity metrics, cost savings, strategic alignment",Business value report,Value target achievement >90%
"Technical Deep Dives",Engineering Community,Bi-weekly,Tech Talks,Subject Matter Expert,"Advanced patterns, troubleshooting, optimization techniques, emerging practices",Technical sessions,Knowledge sharing >85%
"Compliance Audits",Audit Team,Quarterly,Audit Sessions,Compliance Manager,"Control testing, evidence collection, compliance validation, remediation plans",Audit documentation,Audit findings <5 per quarter
"Innovation Showcase",Innovation Teams,Monthly,Innovation Labs,Innovation Lead,"New capabilities, experimental features, proof of concepts, technology trends",Innovation demos,Innovation adoption >70%
"Customer Success",Business Users,Quarterly,Success Reviews,Customer Success Manager,"Usage analytics, success metrics, improvement opportunities, expansion plans",Success scorecard,Customer satisfaction >4.5
"Incident Management",All Stakeholders,As needed,Incident Bridge,Incident Commander,"Incident status, impact assessment, resolution progress, preventive measures",Incident portal,Resolution time <SLA
"Knowledge Sharing",Technical Community,Monthly,Knowledge Base,Knowledge Manager,"Best practices, lessons learned, troubleshooting guides, FAQs",Knowledge articles,Knowledge base usage >80%