Question ID,Category,Sub-Category,Question,Guidance,Customer Response,Notes
BUS-001,Business Requirements,Project Information,What is the name of your CMMC GCC High Enclave project?,"Provide internal project reference name","",Internal project reference for tracking
BUS-002,Business Requirements,Project Information,Who is the primary stakeholder for this CMMC compliance project?,"Name, role, and decision-making authority","",Main point of contact and decision authority
BUS-003,Business Requirements,Business Drivers,What DoD contract opportunities require CMMC Level 2 certification?,"List contract values and timelines for CMMC compliance requirements","",Primary business driver for CMMC investment
BUS-004,Business Requirements,Current State,What is your current approach to handling Controlled Unclassified Information (CUI)?,"Describe on-premises systems, manual processes, or existing cloud solutions","",Current state baseline assessment
BUS-005,Business Requirements,Compliance Status,What is your current CMMC compliance status?,"Options: No compliance, Self-assessment started, C3PAO engaged, Certified Level 1, Pursuing Level 2","",CMMC certification readiness and timeline
BUS-006,Business Requirements,CUI Volume,How many users will access CUI in this environment?,"Typical ranges: 1-25, 26-50, 51-100, 100-250, 250+","",User licensing and access control sizing
BUS-007,Business Requirements,Objectives,What are your primary goals for implementing GCC High Enclave?,"Common goals: Win DoD contracts, Meet CMMC certification, Secure CUI data, Reduce compliance costs, Enable remote collaboration","",Business objectives and expected outcomes
BUS-008,Business Requirements,Success Criteria,How will you measure CMMC enclave success?,"Define KPIs: CMMC certification achieved, contract awards won, compliance cost reduction, audit pass rate","",Success metrics for project evaluation
BUS-009,Business Requirements,Timeline,What is your expected timeline for CMMC Level 2 certification?,"Typical ranges: 0-6 months, 6-12 months, 12-18 months, 18+ months","",Certification timeline expectations and constraints
BUS-010,Business Requirements,Budget,What is your approved budget for CMMC compliance implementation?,"Common ranges: $100K-250K, $250K-500K, $500K-1M, $1M+. Include software licenses and professional services","",Budget constraints for solution sizing
BUS-011,Business Requirements,Future Vision,What is your long-term vision for DoD contracting and CUI handling?,"Consider expansion to additional contracts, agencies, or classification levels","",Future roadmap and scalability planning
BUS-012,Business Requirements,Growth Projections,How do you expect CUI user count and data volume to change over 3 years?,"Provide current users and projected annual growth rate","",Scalability requirements and capacity planning
TECH-001,Technical Requirements,Microsoft 365 Environment,What Microsoft 365 services are you currently using?,"Options: Commercial M365, GCC, GCC High, None, Other cloud collaboration","",Current Microsoft footprint and migration scope
TECH-002,Technical Requirements,Azure Environment,What Azure cloud environment are you currently using?,"Options: Azure Commercial, Azure Government, None, Other cloud provider","",Current Azure footprint and hybrid connectivity
TECH-003,Technical Requirements,CUI Data Classification,What types of CUI data will be stored in this environment?,"Common types: Export-controlled technical data (ITAR/EAR), DoD contract data, Critical infrastructure, Law enforcement, Privacy Act data","",CUI classification affects compliance controls
TECH-004,Technical Requirements,NIST 800-171 Compliance,Which NIST 800-171 control families require implementation?,"Control families: Access Control (AC), Audit & Accountability (AU), Configuration Management (CM), Identification & Authentication (IA), Incident Response (IR), Maintenance (MA), Media Protection (MP), Personnel Security (PS), Physical Protection (PE), Risk Assessment (RA), Security Assessment (SA), System & Communications Protection (SC), System & Information Integrity (SI)","",Determines scope of security controls and automation
TECH-005,Technical Requirements,Authentication Requirements,What authentication methods do you require for CUI access?,"Options: CAC/PIV smart cards, Azure AD MFA, FIDO2 security keys, Conditional Access, Privileged Access Workstations (PAW)","",Identity and authentication architecture design
TECH-006,Technical Requirements,Network Connectivity,What network connectivity is required for the GCC High Enclave?,"Options: ExpressRoute to Azure Gov, Site-to-Site VPN, Internet-only, Hybrid connectivity to on-premises","",Network architecture and security requirements
TECH-007,Technical Requirements,Data Migration,What data needs to be migrated to the GCC High environment?,"List data sources: Email, SharePoint, file servers, databases, applications","",Migration scope and approach planning
TECH-008,Technical Requirements,Email Migration,What email system are you currently using?,"Options: Exchange on-premises, Exchange Online Commercial, Gmail, Other email system","",Email migration strategy and timeline
TECH-009,Technical Requirements,File Storage,What file storage and collaboration systems are currently used?,"Options: On-premises file servers, SharePoint on-prem, SharePoint Online Commercial, Box, Dropbox, Other","",File migration and SharePoint Online GCC High deployment
TECH-010,Technical Requirements,Application Integration,What business applications need to integrate with GCC High?,"List applications requiring SSO, data synchronization, or API integration","",Application compatibility and integration requirements
TECH-011,Technical Requirements,Identity Integration,How will user identities be managed in GCC High?,"Options: Cloud-only Azure AD, Azure AD Connect sync from on-prem AD, Federated with ADFS, Hybrid identity","",Identity architecture and directory synchronization
TECH-012,Technical Requirements,Workload Migration,What workloads will run in Azure Government?,"Common workloads: Virtual machines, Web applications, Databases, Storage accounts, Backup/DR","",Azure Government infrastructure sizing
TECH-013,Technical Requirements,Monitoring Requirements,What security monitoring and logging capabilities do you need?,"Requirements: SIEM (Sentinel), CloudWatch, Threat detection, Compliance dashboards, Audit reporting","",Security operations and compliance monitoring design
TECH-014,Technical Requirements,Backup and Recovery,What backup and disaster recovery requirements apply?,"Specify: RPO (Recovery Point Objective), RTO (Recovery Time Objective), Geo-redundancy requirements","",Business continuity and disaster recovery planning
SEC-001,Security & Compliance,CMMC Level,What CMMC Level certification are you pursuing?,"Options: Level 1 (Basic Cyber Hygiene), Level 2 (Advanced Cyber Hygiene), Level 3 (Expert Cyber Hygiene)","",Determines security control requirements
SEC-002,Security & Compliance,Assessment Timeline,When do you need to complete your CMMC assessment?,"Provide target assessment date and C3PAO engagement status","",Assessment readiness and preparation timeline
SEC-003,Security & Compliance,C3PAO Selection,Have you selected a CMMC Third-Party Assessment Organization (C3PAO)?,"Options: Already selected, Evaluating options, Need recommendations, Not yet started","",Assessment planning and preparation support
SEC-004,Security & Compliance,NIST 800-171 Gaps,What gaps exist in your current NIST 800-171 compliance?,"Describe findings from self-assessment or gaps identified in SPRS score","",Gap remediation scope and timeline
SEC-005,Security & Compliance,SPRS Score,What is your current Supplier Performance Risk System (SPRS) score?,"Provide current score (0-110) and target score","",Compliance baseline and improvement targets
SEC-006,Security & Compliance,Encryption Requirements,What encryption standards must be implemented?,"Requirements: FIPS 140-2 validated encryption, AES-256 at rest, TLS 1.2+ in transit","",Encryption architecture and key management
SEC-007,Security & Compliance,Audit Logging,What audit and logging retention is required?,"CMMC typically requires 1-year online + 6-year archive for audit logs","",Log retention and compliance reporting design
SEC-008,Security & Compliance,Incident Response,What incident response capabilities are required?,"Requirements: 24/7 SOC monitoring, Automated playbooks, Incident investigation, Threat hunting, Forensics","",Security operations center design and staffing
SEC-009,Security & Compliance,Vulnerability Management,What vulnerability scanning and remediation requirements apply?,"Requirements: Weekly scanning, 30-day critical patch timeline, Continuous monitoring","",Vulnerability management and patch automation
SEC-010,Security & Compliance,Access Control,What access control policies must be enforced?,"Common policies: Least privilege, Separation of duties, Need-to-know, Time-based access, Location restrictions","",Role-based access control (RBAC) design
SEC-011,Security & Compliance,Physical Security,What physical security controls are required for endpoints?,"Controls: Encrypted laptops, Secure boot, TPM, Endpoint DLP, Mobile device management","",Endpoint security and device management
SEC-012,Security & Compliance,Supply Chain Risk,What supply chain risk management (SCRM) requirements apply?,"Requirements: Vendor assessment, Software composition analysis, Third-party security validation","",Supply chain security controls
OPS-001,Operations & Support,Availability,What uptime requirements do you have for CUI systems?,"Common targets: 99.5%, 99.9%, 99.95% (Microsoft GCC High SLA is 99.9%)","",SLA requirements drive architecture design
OPS-002,Operations & Support,Support Coverage,What support coverage do you require for CUI environment?,"Options: Business hours (8x5), Extended (24x5), Full (24x7)","",Support staffing and cost planning
OPS-003,Operations & Support,SOC Services,Do you need managed SOC services for Sentinel SIEM?,"Options: In-house SOC, Managed SOC (24x7), Co-managed SOC, Microsoft detection/response only","",Security operations staffing and service model
OPS-004,Operations & Support,Change Management,What change management processes must be followed?,"Describe approval workflows, change windows, rollback procedures","",Change control and configuration management
OPS-005,Operations & Support,Compliance Reporting,What compliance reporting is required?,"Reports: Monthly compliance dashboards, NIST 800-171 control status, CMMC assessment prep, SPRS score updates","",Compliance monitoring and reporting automation
OPS-006,Operations & Support,User Support,How will end-user support be provided for GCC High users?,"Options: Internal helpdesk, Managed service provider, Microsoft FastTrack, Hybrid model","",End-user support model and training
OPS-007,Operations & Support,Training Requirements,What CMMC and security awareness training is required?,"Training types: Annual security awareness, Role-based training, Privileged user training, Incident response drills","",Security training program and compliance
IMPL-001,Implementation Planning,Resources,Who will be the technical lead for this CMMC GCC High project?,"Name, role, contact information, security clearance level","",Technical ownership and project management
IMPL-002,Implementation Planning,Team Availability,What internal resources are available for CMMC implementation?,"List team members, roles, time commitment, and CMMC/security expertise","",Resource planning and project timeline feasibility
IMPL-003,Implementation Planning,Microsoft Experience,What is your team's experience with Microsoft 365 and Azure Government?,"Experience levels: No experience, Basic knowledge, Intermediate, Advanced, Expert","",Training needs assessment and knowledge transfer requirements
IMPL-004,Implementation Planning,Migration Approach,What is your preferred migration approach for GCC High?,"Options: Phased by department, Pilot then scale, Big bang cutover, Parallel run with commercial","",Implementation strategy and risk mitigation
IMPL-005,Implementation Planning,Parallel Run,Do you require a parallel run period with existing systems?,"Specify duration if needed (typically 1-3 months for email/collaboration)","",Implementation timeline and validation approach
IMPL-006,Implementation Planning,Change Management,How will you handle the transition to GCC High environment?,"Consider communication, training, user adoption, business process changes","",Change management and user adoption strategy
IMPL-007,Implementation Planning,Training Needs,What training will be needed for users and administrators?,"Types: End-user M365 training, Azure admin training, Security operations training, CMMC awareness","",Knowledge transfer scope and timeline
IMPL-008,Implementation Planning,Testing Requirements,What testing approach do you prefer for GCC High deployment?,"Options: Pilot user group, Department-by-department, Phased rollout, Full cutover","",Testing and validation requirements
IMPL-009,Implementation Planning,Approval Process,What approval processes are required for CMMC compliance changes?,"Describe change control, ISSO/ISSM approvals, ATO process, governance","",Change approval and governance requirements
IMPL-010,Implementation Planning,Partner Requirements,What Microsoft GCC High implementation experience do you expect from partners?,"Specify: Microsoft partner status, CMMC expertise, DoD clearances, past GCC High projects","",Partner selection criteria and requirements
RISK-001,Risk & Constraints,Implementation Risks,What are your main concerns about implementing GCC High Enclave?,"Consider: Migration complexity, User adoption, Cost, Timeline, Certification readiness","",Primary implementation concerns and risk factors
RISK-002,Risk & Constraints,Failure Factors,What could cause this CMMC project to fail?,"Consider: Budget overruns, Assessment delays, Lack of executive support, Insufficient security controls, Data migration issues","",Failure mode analysis and mitigation planning
RISK-003,Risk & Constraints,Contract Risks,What contract opportunities are at risk without CMMC certification?,"List specific DoD contracts, values, and award timelines dependent on CMMC","",Business impact and urgency assessment
RISK-004,Risk & Constraints,Technical Risks,What technical risks worry you most about GCC High migration?,"Consider: Application compatibility, Identity federation, Network connectivity, Data migration, Performance","",Technical risk factors and mitigation strategies
RISK-005,Risk & Constraints,Dependencies,What external dependencies exist for this project?,"Examples: DoD contract awards, C3PAO availability, Budget approvals, Azure Gov subscription, Vendor coordination","",Project dependencies and critical path items
RISK-006,Risk & Constraints,Constraints,What constraints must the solution work within?,"Consider: Budget limits, Timeline, Existing infrastructure, Regulatory, Security clearances, Contract deadlines","",Solution design boundaries and constraints
